{
  "id": "71009",
  "msisdn": "8990123456",
  "status": "ACTIVE",
  "user_type": "MPCS production",
  "network": "CDMA",
  "tnc_version": 0,
  "privacy_version": 0,
  "current_song_status": "UNREGISTERED",
  "operator_name": "VODAFONE",
  "circle_name": "JAMMU",
  "time_zone_string": "America/New_York",
  "external_id": "8990123456",
  "languages": ["en", "hi"],
  "first_name": "Vishal"
}